{
  "$schema":"https://json-schema.org/draft/2020-12/schema",
  "$id":"https://kristal.local/kristaldiag/driver.schema.json",
  "title":"KristalDiag Implementation Driver",
  "type":"object",
  "required":["schema","implementation","claimed_profile","actions"],
  "properties":{
    "schema":{"const":"kristaldiag.driver.v1"},
    "implementation":{"type":"string","minLength":1},
    "claimed_profile":{"enum":["V7-Reader","V7-Mesh","V7-Projection","V7-Kristall"]},
    "actions":{"type":"object","additionalProperties":{"type":"object","required":["argv"],"properties":{"argv":{"type":"array","minItems":1,"items":{"type":"string","minLength":1}},"description":{"type":"string"}},"additionalProperties":false}}
  },
  "additionalProperties":false
}
